{
  "specVersion": "0.1.0",
  "projectId": "harmonic-audio-analytics",
  "projectName": "Harmonic Audio — Fan Engagement Analytics",
  "projectDescription": "Fictional streaming audio company: maps ingestion, dbt-style models, metrics, and dashboards.",
  "domains": ["growth", "product", "trust_safety"],
  "nodes": [
    {
      "id": "team-data-platform",
      "type": "team",
      "name": "data_platform",
      "displayName": "Data Platform",
      "description": "Owns core pipelines and modeling standards.",
      "trustLevel": "trusted",
      "status": "active",
      "tags": ["owner_group"]
    },
    {
      "id": "owner-maya-chen",
      "type": "owner",
      "name": "maya.chen",
      "displayName": "Maya Chen",
      "description": "Analytics engineering lead.",
      "trustLevel": "trusted",
      "status": "active",
      "tags": ["person"]
    },
    {
      "id": "src-snowplow",
      "type": "source_system",
      "name": "snowplow",
      "displayName": "Snowplow (events)",
      "description": "Behavioral event stream for web and mobile clients.",
      "trustLevel": "trusted",
      "status": "active",
      "ownerId": "owner-maya-chen",
      "tags": ["events"]
    },
    {
      "id": "src-billing",
      "type": "source_system",
      "name": "stripe",
      "displayName": "Stripe Billing",
      "description": "Subscriptions and invoices.",
      "trustLevel": "trusted",
      "status": "active",
      "tags": ["finance"]
    },
    {
      "id": "raw-events",
      "type": "raw_table",
      "name": "raw.snowplow.events",
      "displayName": "Raw Snowplow Events",
      "description": "Append-only landing table for Snowplow enriched events.",
      "grain": "event",
      "trustLevel": "reviewed",
      "status": "active",
      "ownerId": "owner-maya-chen",
      "tags": ["landing"],
      "usageHints": ["Filter client-generated events using event_vendor = 'harmonic'."],
      "metadata": {
        "starSchemaRole": "staging",
        "physical": {
          "warehouse": "snowflake",
          "database": "HA_ANALYTICS",
          "schema": "RAW",
          "relation": "RAW.SNOWPLOW.EVENTS"
        },
        "columns": [
          { "name": "event_id", "physicalType": "varchar(64)", "keys": ["PK"], "description": "Snowplow event UUID" },
          { "name": "event_ts", "physicalType": "timestamp_tz(9)", "keys": [], "description": "Collector timestamp" },
          { "name": "user_id", "physicalType": "varchar(64)", "keys": ["FK->dim_fan"], "description": "Hashed fan id" },
          { "name": "artist_id", "physicalType": "varchar(64)", "keys": ["FK->dim_artist"], "description": "Artist dimension key" },
          { "name": "event_name", "physicalType": "varchar(128)", "keys": [], "description": "Self-describing event name" }
        ]
      }
    },
    {
      "id": "raw-subscriptions",
      "type": "raw_table",
      "name": "raw.stripe.subscriptions",
      "displayName": "Raw Stripe Subscriptions",
      "grain": "subscription_id",
      "trustLevel": "reviewed",
      "status": "active",
      "ownerId": "owner-maya-chen",
      "tags": ["landing"]
    },
    {
      "id": "stg-events-clean",
      "type": "staged_model",
      "name": "stg_snowplow_events_clean",
      "displayName": "Stg — Clean Snowplow Events",
      "description": "Typed columns, bot filtering, PII hashing.",
      "grain": "event",
      "trustLevel": "reviewed",
      "status": "active",
      "ownerId": "owner-maya-chen",
      "tags": ["staging"],
      "metadata": {
        "starSchemaRole": "staging",
        "physical": {
          "warehouse": "snowflake",
          "database": "HA_ANALYTICS",
          "schema": "STG",
          "relation": "STG.SNOWPLOW.EVENTS_CLEAN"
        },
        "columns": [
          { "name": "event_id", "physicalType": "varchar(64)", "keys": ["PK"] },
          { "name": "is_bot", "physicalType": "boolean", "keys": [], "description": "Heuristic bot filter" },
          { "name": "user_id", "physicalType": "varchar(64)", "keys": [] }
        ]
      }
    },
    {
      "id": "int-user-day-listening",
      "type": "intermediate_model",
      "name": "int_user_day_listening",
      "displayName": "User-Day Listening Sessions",
      "description": "Rolls events into bounded listening sessions per user-day.",
      "grain": "user_day",
      "trustLevel": "reviewed",
      "status": "active",
      "ownerId": "owner-maya-chen",
      "tags": ["intermediate"],
      "caveats": ["Sessions split at 30 minutes of inactivity; mobile background audio may overcount."],
      "metadata": {
        "starSchemaRole": "fact",
        "physical": {
          "warehouse": "snowflake",
          "database": "HA_ANALYTICS",
          "schema": "INT",
          "relation": "INT.USER_DAY_LISTENING"
        },
        "columns": [
          { "name": "user_sk", "physicalType": "number(38,0)", "keys": ["FK->dim_fan"] },
          { "name": "listening_date", "physicalType": "date", "keys": ["PK"] },
          { "name": "minutes_listened", "physicalType": "float", "keys": [] }
        ]
      }
    },
    {
      "id": "mart-fan-artist-week-affinity",
      "type": "mart_model",
      "name": "mart_fan_artist_week_affinity",
      "displayName": "Fan-Artist Weekly Affinity",
      "description": "Weekly affinity scores between fans and artists.",
      "grain": "fan_artist_week",
      "trustLevel": "trusted",
      "status": "active",
      "ownerId": "owner-maya-chen",
      "tags": ["mart", "growth"],
      "usageHints": ["Prefer this grain for artist-level CRM campaigns."],
      "metadata": {
        "starSchemaRole": "fact",
        "physical": {
          "warehouse": "snowflake",
          "database": "HA_ANALYTICS",
          "schema": "MART",
          "relation": "MART.GROWTH.FAN_ARTIST_WEEK_AFFINITY"
        },
        "columns": [
          { "name": "fan_sk", "physicalType": "number(38,0)", "keys": ["FK->dim_fan"] },
          { "name": "artist_sk", "physicalType": "number(38,0)", "keys": ["FK->dim_artist"] },
          { "name": "week_start", "physicalType": "date", "keys": ["PK"] },
          { "name": "affinity_score", "physicalType": "float", "keys": [] }
        ]
      }
    },
    {
      "id": "mart-subscriber-health",
      "type": "mart_model",
      "name": "mart_subscriber_health",
      "displayName": "Subscriber Health Snapshot",
      "grain": "user_id",
      "trustLevel": "trusted",
      "status": "active",
      "ownerId": "owner-maya-chen",
      "tags": ["mart", "finance"],
      "metadata": {
        "starSchemaRole": "fact",
        "physical": {
          "warehouse": "snowflake",
          "database": "HA_ANALYTICS",
          "schema": "MART",
          "relation": "MART.FINANCE.SUBSCRIBER_HEALTH"
        },
        "columns": [
          { "name": "user_sk", "physicalType": "number(38,0)", "keys": ["PK", "FK->dim_fan"] },
          { "name": "dunning_stage", "physicalType": "varchar(32)", "keys": [] },
          { "name": "mrr", "physicalType": "number(18,2)", "keys": [] }
        ]
      }
    },
    {
      "id": "metric-weekly-active-fans",
      "type": "metric",
      "name": "weekly_active_fans",
      "displayName": "Weekly Active Fans (WAF)",
      "description": "Count of fans with ≥1 minute listened in trailing 7 days.",
      "grain": "user_week",
      "trustLevel": "trusted",
      "status": "active",
      "ownerId": "owner-maya-chen",
      "tags": ["kpi", "growth"]
    },
    {
      "id": "metric-churn-risk",
      "type": "metric",
      "name": "churn_risk_score",
      "displayName": "Churn Risk Score",
      "description": "Heuristic score 0-100 from listening drop-offs and billing dunning signals.",
      "grain": "user_id",
      "trustLevel": "draft",
      "status": "draft",
      "ownerId": "owner-maya-chen",
      "tags": ["kpi", "experimental"],
      "caveats": ["Draft model — do not use for finance reporting."]
    },
    {
      "id": "dash-growth-pulse",
      "type": "dashboard",
      "name": "growth_pulse",
      "displayName": "Growth Pulse",
      "description": "North-star KPIs for leadership reviews.",
      "trustLevel": "reviewed",
      "status": "active",
      "ownerId": "owner-maya-chen",
      "tags": ["looker", "exec"]
    },
    {
      "id": "evt-play-completed",
      "type": "event_definition",
      "name": "play_completed",
      "displayName": "Play Completed",
      "description": "Emitted when a listening session completes a track.",
      "grain": "event",
      "trustLevel": "trusted",
      "status": "active",
      "tags": ["taxonomy"]
    },
    {
      "id": "ent-fan",
      "type": "entity",
      "name": "fan",
      "displayName": "Fan (Listener)",
      "description": "Registered listener account.",
      "grain": "user_id",
      "trustLevel": "trusted",
      "status": "active",
      "tags": ["semantic"]
    },
    {
      "id": "dim-artist",
      "type": "dimension",
      "name": "artist",
      "displayName": "Artist",
      "description": "Creator profile dimension.",
      "grain": "artist_id",
      "trustLevel": "trusted",
      "status": "active",
      "tags": ["semantic"],
      "metadata": {
        "starSchemaRole": "dimension",
        "scdType": "2",
        "physical": {
          "warehouse": "snowflake",
          "database": "HA_ANALYTICS",
          "schema": "MART",
          "relation": "MART.SEMANTIC.DIM_ARTIST"
        },
        "columns": [
          { "name": "artist_sk", "physicalType": "number(38,0)", "keys": ["PK"] },
          { "name": "artist_id", "physicalType": "varchar(64)", "keys": ["NK"] },
          { "name": "display_name", "physicalType": "varchar(256)", "keys": [] },
          { "name": "valid_from", "physicalType": "timestamp_tz(9)", "keys": ["SCD2"] },
          { "name": "valid_to", "physicalType": "timestamp_tz(9)", "keys": ["SCD2"] },
          { "name": "is_current", "physicalType": "boolean", "keys": ["SCD2"] }
        ]
      }